v1,v2, , , 
NINGUNO,"La imagen que te define son tus valores!!...la moda representa seguir estereotipos sociales que te hacen parte del montón, en lo personal tu imagen debería reflejar aquello que te hace ser único, tu honradez, tu amabilidad o solo el hecho de respetar a los demás.", , , 
VANIDAD,El Tener amor propio debe ser una prioridad en nosotros para poder sentirnos a gusto con nuestro físico y sobre todo  por la maravillosa persona que somos y debemos lucir bien ante las demás personas  y estar a la moda no debe ser una prioridad., , , 
NINGUNO,Existen muchas personas que no se aman asi mismo fisicamente y la otra vez se siente inseguro y sienpre tratan de dar una buena imangen con todos los demas., , , 
VANIDAD,"Opinó qué la imagen es tan importante como salud , ""estar bien, es verse bien"".  A demás de estar a la moda, perdemos nuestra propia forma de vestir que identifica  nuestra imagen. El ser originales sin seguir las tendencias.", , , 
VANIDAD,"Constantemente es fundamental conservar la esencia de sí mismo, empero además es bueno tener una buena imagen, ya que ayuda a que la población sienta mas empatía contigo. ", , , 
NINGUNO,No por que la moda es algo pasajero pero la educación los valores eso si es propio de cada persona. , , , 
NINGUNO,"No por vestir a la moda significa que una persona tenga educación y valores, aquí se puede destacar la frase de ""no todo es, lo que aparenta ser"". Por el contrario, la educación siempre debe ser prioridad.", , , 
VANIDAD,El Amor Propio Consta de aceptarse tal y como eres  y hacer que tu autoestima crezca día a día para  convertirte en una persona segura de ti misma y poder avanzar.Estar a la moda es una tendencia y no todos deben estarlo ya que es algo opcional en cada persona., , , 
VANIDAD,LA IMAGEN DE CADA PERSONA ES ALGO SUPERFICIAL DE AQUELLA PERO EL AMARSE A SI MISMO CON DEFECTOS Y VIRTUDES ES SER UNA PERSONA SEGURA Y CAPAZ DE TODO. , , , 
NINGUNO,La moda no tiene que ver en absolutamente nada con la educación , , , 
NINGUNO,la actualidad la persona viven acomplejada de verse bien por fuera mientras que por dentro no trabajan su autoestimas ya que por afuera en temporal llegara el día en que todo será ira pero la belleza del interior es al que mantendrá siempre al pasar de años., , , 
NINGUNO,"A mi pensar el amor propio es una limitación que sólo puede ser vista y estigmatizada por cada ser, tomando la imagen como ejemplo, no por vestir bien la sociedad tendría la conclusión precisa de que me amo cuando en realidad puede ser todo lo contrario.", , , 
VANIDAD,"El amor propio debe ir más allá de los estándares impuestos por la sociedad, es decir, no se define por tu peso, talla o la manera de vestir. El amor propio se debe reflejar en nuestra autoestima y en la aceptación que tenemos hacia nosotros mismos.", , , 
VANIDAD,"Siempre es importante mantener la esencia de uno mismo, pero también es bueno tener una buena imagen, porque ayuda a que la gente sienta mas empatía contigo. Tampoco olvidemos que la actitud y amor propio hacen mucho mas que un atuendo.", , , 
NINGUNO,Existen muchas personas que no se aman a sí mismo fisicamente y a la vez se sienten inseguros y siempre tratan de dar una buena imagen con los demás. Pero una aspecto importante sería que tu físico no depende de tu imagen frente a los demás., , , 
VANIDAD,"La imagen personal es muy importante, es algo que debemos cuidar independientemente de nuestra edad, hablando del amor propio esto se debe basar siempre en lo que nosotros queremos llegar a ser no cómo los demás quieren que seamos.", , , 
NINGUNO,"No por vestir a la moda significa que una persona tenga educación y valores, aquí se puede destacar la frase de ""no todo es, lo que aparenta ser"". Por el contrario, la educación siempre debe ser prioridad.", , , 
VANIDAD,"Tengo mucho amor propio, es algo en lo que he trabajado en años, pero no me interesa estar a la moda o seguir influencias de los demás. Soy un ser único e irrepetible, al cual debo amar primero para poder amar a los demás.", , , 
VANIDAD,"Como dice Justin Bieber, ""Love yourself"" xd", , , 
NINGUNO,"El mundo basado en una ""imagen perfecta"" se vuelve totalmente indiferente hacia los sentimientos y lo que existe detras de cada persona. Si la humanidad se volcara al mismo pensar  dejarámos de ser humanos. Porque todo fuera superficial no avanzariamos. ", , , 
NINGUNO,"Ni lucir bien, ni estar a la moda debe ser una prioridad en lo absoluto, y el amor propio es sabernos valorar por como somos, buscando ser mejores personas cada día, independientemente de nuestro físico. ", , , 
VANIDAD,"El amor propio es auto valorarse, aceptarse por lo que es, se basa por nuestros comportamientos y actitudes, además,  no es necesario estar a la moda para aparentar lo que no somos. Depende el tiempo llegan las personas correctas a tu vida.", , , 
NINGUNO,"Los más prioritario es tener salud, ser agradecidos cada día de nuestras vidas, tener valores, amarse tal y cual somos, aprender a escuchar, observar y destacarse, pero sobre todas las cosas, querer bonito a los demás. De ahí el resto es secundario, como la moda.", , , 
NINGUNO,"El lucir bien no se trata de llevar consigo lo más fino, o costoso. una persona que luce bien denota muchas cualidades a resaltar como, el orden, la alta autoestima, la aceptación por su físico, entre otras más, por supuesto va ligada a la educación. ", , , 
VANIDAD,"Si es importante, dependiendo del punto de vista de cada uno, ya que debemos preocuparnos por nosotros mismos pero siempre viendo lo que este cómodo para nosotros, no lo que las demás personas quieren para nosotros. ", , , 
NINGUNO,"con amor propio completamos toda nuestra personalidad y así seremos más seguros de nosotros mismos, la educación es más importante ante la moda que queremos seguir por quedar bien o encajar en una sociedad que probablemente no nos beneficie en un futuro.", , , 
NINGUNO,"No es tan necesario seguir las modas para demostrar amor propio, el amor propio se demuestra por como te aceptas y te valoras como persona, mejorando día a día.", , , 
VANIDAD,La primera impresión siempre cuenta, , , 
VANIDAD,"El amor propio surge del autoconocimiento, estima, consideración y cuidado (emocional, físico y mentalmente) de uno mismo y esto no se refleja en seguir tendencias modistas, pero considero que tener una buena imagen es importante pero no esencial.", , , 
NINGUNO,la moda no importa lo  que  importa es la actitud de cada persona, , , 
VANIDAD,"Siempre se debe sentir amor hacia nosotros mismos, es lo primordial en todo lo que hagamos, eso también implica llevar una buena imagen, la gente puede hablar, pero mientras estemos seguros de nosotros mismos no hay quien nos detenga.", , , 
NINGUNO, El aspecto es lo de menos pero siempre se debe de tomar en cuenta la educación, , , 
VANIDAD,"El amor propio es lo fundamental de cada persona, teniendo aquello  se sentirá seguro de si mismo y no le dará importancia a comentarios que afecten en el rendimiento de su día a día.", , , 
NINGUNO," La imagen solo sirve para dar primeras impresiones de las cuales muchos basan su criterio sobré ti, pero eso tampoco te define eres más que una imagen y supongo que debés cuidar mucho más otros aspectos de la vida sin descuidar tampoco tu imagen", , , 
VANIDAD,La imagen es importante ya que es nuestra presentación ante el mundo no obstante si te sientes bien estando gordo o flaco con sobrepeso o con anorexia está bien por qué ya es desicion de cada uno  y de eso se trata el amor propio aceptarse como uno es, , , 
VANIDAD,"Tienes razón es muy importante como vestimos, ya que en la actualidad te tratan por como te ven.", , , 
VANIDAD,"El amor propio es muy importante para una persona,  lo de estar a la ""moda"" solo es un complemento, pero los valores y la educación la pones tú, no lo que vistes.", , , 
VANIDAD,Cada uno debe vestir como quiera cada uno debe sentirse feliz con lo que hace sin importar el comentario de las demás personas cada quien vive su vida a su gusto, , , 
NINGUNO,La moda no tiene nada que ver con la educación , , , 
VANIDAD,"Estar a la moda te hace ver bien pero para mi lo mas importante es la Educación, también considero que el amor propio es lo más importante que puede tener una persona. ", , , 
NINGUNO,Vivimos en una sociedad llenos de críticas donde el lucir a la moda está bien pero lo que importa es la educación que tenemos mediante los años que nos dan la sabiduría de ser mejores como persona porque el esfuerzo de ahora es la riqueza del mañana., , , 
NINGUNO,"La moda no debe ser prioridad, la educación si.", , , 
NINGUNO,"El amor propio combina una serie de cuestiones como la autoestima, la confianza, la seguridad y la aceptación. Se trata de conocer y aceptar quiénes somos o quién queremos llegar a ser y apuntar a ello.", , , 
VANIDAD,"La imagen personal es muy importante, es algo que debemos cuidar siempre y no necesariamente estando a la moda. Bendiciones", , , 
NINGUNO,"El amor propio, es la aceptación hacia nosotros mismo, gustos, el físico, defectos, sin importar las opiniones de los demás. El vestirse a la moda o tener una buena imagen hacia los demás, no debe ser tan importante, mientras nos sintamos a gusto.", , , 
VANIDAD,"Mas allá de la moda y si te gusta seguir las tendencias, nuestra autoimagen tiene un fuerte y directo impacto en nuestro estado de ánimo.  Cuando me veo bien, me siento bien.  El autoestima aumenta, la confianza y seguridad también y por tanto nuestro bienestar.", , , 
VANIDAD,"Como te veas es muy importante hasta cierto punto, nuestra imagen es algo que debemos cuidar, sin embargo el amor propio se basa en quien queremos llegar a ser y la forma en la que nos sentimos bien, no cómo los demás quieren que seamos o como nos vean.", , , 
VANIDAD,"El amor propio no sólo se refleja en cómo nos vemos, se refleja en nuestros actos hacia nuestro propio bienestar, ya sea comer o dormir bien, disfrutar nuestro postre favorito, etc. Así tendremos una óptima imagen de lo que somos por dentro y de lo reflejamos.", , , 
NINGUNO,"Considero que el amor es un término relativo y que el amor a uno mismo también lo es, creo que la manera de presentarnos ante los demás a pesar de ser socialmente necesaria no creo que signifique que tanto nos podemos llegar a querer como personas.", , , 
NINGUNO,"Lucir bien, presentable cuando mucho es importante porque es la primera impresión que tienen los demás de nosotros, no quiere decir que la moda sea una prioridad, con que nos sintamos bien y cómodos basta, nuestra educación siempre será más importante.", , , 
VANIDAD,"Vestir a la moda no necesariamente significa amor propio, considero que es más bien el cuidado y el querer lucir bien para sí mismo, así demostramos varias cualidades que no se denotan en una persona que no cuida de el/ ella.", , , 
VANIDAD,"Una de las maneras de empezar a quererse con sus virtudes y defectos es teniendo amor propio, claro que es importante la imagen que damos a mostrar en nuestro círculo social, pero lo indispensable aquí es la esencia que es lo que a una persona atrae.", , , 
NINGUNO,"La educación la impone uno mismo, y en mucho de los casos desde casa, y es algo que no podría compararse por el simple hecho de vestir bien; lamentablemente muchas de las personas hoy en día creen que por vestir bien es una persona con una buena educación.", , , 
VANIDAD,Lucir bien y estar a la moda puede ser una prioridad pero siempre y cuando tengamos un buen control en nosotros mismo. , , , 
VANIDAD,"El autoestima y amor propio hacia uno mismo es el primer paso para poder aceptarnos y así cambiar por dentro, pero tampoco hay que descuidar como nos vemos por fuera si nuestra imagen es nuestra carta de presentación ante el mundo.", , , 
NINGUNO,Para decir verdad la moda si es importante pero para que una persona la compare con la educación no son cosas muy distintas., , , 
VANIDAD, Mi opinión sobre la pregunta es que a pesar de como  podemos estar lo importante es amarse tal como somos , , , 
VANIDAD,"El amor propio es aprender a amar tu cuerpo y reconocer lo valioso que es aceptarte tal y como eres, sin compararte con nadie y que las partucularidades son las que nos hacen auténtico.", , , 
NINGUNO,Importante en la educación forrada desde casa en los principios de ética que tienen cada persona el que está bien o mal no lo hace mala persona lo hace unico., , , 
NINGUNO,"Estar a la moda no es una prioridad, el lucir bien no define nuestra educación solo nos damos una buena imagen. ", , , 
NINGUNO,En lo personal mas que estar a la moda para sentirme bien me gusta sentirme bien conmigo mismo., , , 
VANIDAD,"Decir que el sobrepeso es sinónimo de no tener amor propio me parece errado, pueden existir personas delgadas que no precisamente cuiden su salud. Lucir bien depende de la actitud y seguridad que emites. ", , , 
NINGUNO,"La figura personal depende  del sentimiento que uno mismo siente, ademas de eso una persona debe sentrarse en lo ella piensa y cree no lo que los demas desean.", , , 
VANIDAD,"Asi es mi estimado, el amor propio ante todo.", , , 
NINGUNO,El amor propio es más que vestir a la moda y lo  más importante es la educación., , , 
VANIDAD,"El vestirse bien es importante para reflejar una buena imagen, pero el amor propio es un tema distinto ya que es aceptarse como somos sin buscar seguir modas para ser aceptado por el resto.", , , 
VANIDAD,"Cuando se mantiene una buena imagen es el reflejo de como nos sentimos por dentro, es amor propio, empieza desde una buena actitud, hasta la manera en la que nos reflejamos con nuestros actos, el estilo y la aptitud va más de la moda.", , , 
NINGUNO,"El amor propio es lograr aceptarse tal y como eres todos tenemos debilidades y fortalezas, porque que es necesario que te tomes un momento para apreciar lo increíble que eres incluso si tienes fallas, lo importante es que te sientas bien contigo mismo.", , , 
NINGUNO,"La vestimenta no hace a la persona.  Lo que destaca de uno son  sus valores. Puedes vestir con la ropa más cara, puedes tener una hermosa figura pero si tratas mal y no sabes valorar a los demás no mereces ni siquiera llamarte persona.", , , 
NINGUNO,"La imagen personal de una persona depende del entorno donde estemos, no tiene nada que ver con el amor propio, los esterotipos sociales, nos dominan hoy en dia, un ejemplo claro es el creer que tu imagen personal es la que te define, si eres capaz o no.", , , 
VANIDAD,"Para sentirse bien con uno mismo, para sentirse inclusive mas sano, la imagen es super importante desde siempre y hay qie ajustarse a los estándares establecidos por la sociedad si queremos encajar y estar bien con los demás", , , 
VANIDAD,"La imagen que uno refleja ante los demás muchas veces define la manera en la que te van a tratar. Así que, primero se debería tener amor propio para que uno pueda reflejar seguridad y la gente te pueda respetar con lo que estés vistiendo.", , , 
NINGUNO,"El amor propio es crucial porque cuando la gente empieza a conocernos, la seguridad que tenemos en nosotros puede marcar la relación que mantenemos con los demás individuos de nuestro entorno. ", , , 
NINGUNO,Positivo, , , 
NINGUNO,"Creo que amarte tal como eres es un reflejo de amor propio, sin importar como luzcas para la sociedad.", , , 
VANIDAD,"Con lucir bien esta mejor, pero a la moda sería ya vanidad, el aspecto que nosotros damos ante los demás es lo primordial. El amor propio es aceptarse como tal.", , , 
VANIDAD,Nuestra imagen debemos cuidar a diario vernos bien no solo para presumir o algo así simplemente para sentirnos bien con nosotros mismos y la moda no está mal mientras seamos humildes todo estaría, , , 
PRETENSION,Por lo general la gente se deja llevar por los sentimientos asi que yo creo que no  , , , 
NINGUNO,En realidad  yo si el niño no tiene la culpa , , , 
PRETENSION,Una solucion puede ser buscar a la otra parte infiel y hacerla responsable...  yo creo que no podria, , , 
NINGUNO,"En una infidelidad todo se rompe, muchas veces muy dificil de llevar, pero si se llega a superar aquello si seria capaz de hacerlo siempre y cuando se hagan las cosas claras y no tomar como excusa la adopcion para intentar dar una solucion a aquello que quizas no lo tenga... ", , , 
NINGUNO,"Yo si lo haria, despues de todo el niño no tiene la culpa de nada", , , 
PRETENSION,"Realmente no podria, existen miles de opciones como posibles soluciones. ", , , 
NINGUNO,"Si, porque un niño no tiene la culpa de los errores que cometemos los adultos. ", , , 
NINGUNO,"Una infidelidad es dificil de perdonar, practicamente ya no existe confianza, la relacion no seria la misma, sin embargo adoptar al niño/a ser­a una accion solidaria ya que le brindara un hogar y cariño a alguien que lo necesita y se podra considerar", , , 
NINGUNO,"Un niño nunca tiene la culpa de los errores que cometemos los padres, y si tengo los recursos de cuidarlo, claro que lo adoptaria", , , 
NINGUNO,Es verdad que cuando una infidelidad en una de las dos partes todo lo que se construya se pierde. Pero un hijo es una bendicion y mas en una situacion asi. El hijo no tiene la culpa de nada el no puede nacer en una situacion asi , , , 
NINGUNO,"Los niños no tienen la culpa, se estara ayudando a alguien necesitado", , , 
NINGUNO,Quien sabe!!, , , 
PRETENSION,"En primera diria que si, porque a la final el niño no tiene culpa de nada pero en realidad no estaria segura es que una cosa es decirlo por responder esta pregunta y otra vivirlo y tomar la decision en ese preciso momento.", , , 
NINGUNO,"Yo diria que si, aunque una infidelidad es algo que no se supera de la noche a la mañana pero a la final todos cometemos errores en la vida y el niño no tiene la culpa.", , , 
NINGUNO,"Si , por que el niño no tiene culpa de los errores que cometieron sus padres", , , 
PRETENSION,"Una situacion muy dificil de encontrar, seria de pasar esa realidad para saber que decision se tomaria. Pero por el momento no seria capaz de adoptar. ", , , 
NINGUNO,Nose quizas , , , 
PRETENSION,Yo realmente pienso que no seria capaz., , , 
NINGUNO,Si deben tener un corazon ya sea de otra familia o infedilidad y apdotar al niño o niña , , , 
NINGUNO,"Creo que el niño no tiene la culpa de los errores que como adulto cometemos, pero si esta en mis posibilidades apoyarlo creo que si lo haria, hay que ver el otro lado de la familia del niño si desean que pase eso. ", , , 
NINGUNO,La respuesta es Si podemos brindar amor al niño que lo esta necesitando. , , , 
PRETENSION,"Pues seria dificil ya que al tener contacto con el niño tendría siempre presente que mi pareja me fue infiel, pero si puede llegar a  posible darle un nuevo hogar al niño y poder empezar de cero ", , , 
NINGUNO,"si ,por que no me gustaria que ese hijo quedara sin la falta de una madre o un padre ", , , 
NINGUNO,"Pues en mi caso no perdonaria la infidelidad de mi pareja pero en caso de que el niño no tuviera familia y pues el padre no se quiera hacer cargo, si adoptari­a al niño ya que el no tiene la culpa de nada ", , , 
NINGUNO,Yo creo que si por que no tienen la culpa y ellos no merecen sufrir por los errores de los adultos , , , 
NINGUNO,"Existen y conozco casos que se dan.. por mi parte lo pensaria muy bien ya que una infidelidad es dificil de perdonar, pero un niño no tiene la culpa de nacer en ese tipo de situaciones...tomari­a una decision madura y al final hacerme cargo.. ", , , 
NINGUNO,"Pues si lo adoptaria Por que es un ser humano que necesita cuidados, amor y sobre todo tiempo y no tiene la culpa de los errores de sus padres", , , 
PRETENSION,"No lo adoptaria, pero si le brindaria apoyo emocional e incluso tal vez economico en caso de que el padre no quisiera hacerse responsable de el/ella. Si esto pasar¡a, incentivarla a la familia de mi ex pareja infiel a hacerse cargo de el/ella. ", , , 
NINGUNO,"Si seria capaz, el niño no tiene la culpa de la infidelidad del padre o madre. Quizas fue un error o incluso si el amor mutuo se acaba, cuando una persona ama de verdad esta dispuesta a perdonar ", , , 
NINGUNO,"En una infidelidad todo se rompe, muchas veces muy dificil de llevar, pero si se llega a superar aquello si seria capaz de hacerlo siempre y cuando se hagan las cosas claras y no tomar como excusa la adopcion para intentar dar una solucion a aquello que quizas no lo tenga.. ", , , 
NINGUNO,Si por que el hijo necesita ayuda ya que ella no podria mantenerlo ella sola, , , 
NINGUNO,Si el padre antes de fallecer fue sincero y acepto y explico todo no tendria problema por que el hijo de esa infidelidad no tendria nada que ver con lo que cometio el papa yo si lo adoptari­a y aparte tambien seria los hermanos de mis hijos., , , 
PRETENSION,"No lo adoptaria pero le brindaria ayuda moral e incondicional, ademas solicitaria a sus familiares directos q de hagan cargo ya q el hijo no tiene la culpa de nada3", , , 
NINGUNO,"considero que brindar un hogar a un niño es una bendicion que Dios le esta dando por intermedio de nosotros. Si la adopcion es una de las soluciones, si lo hari­a, sin ver lo que haya pasado con la pareja que haya tenido entre ellos una infidelidad. ", , , 
NINGUNO,La verdad es una gran pregunta... Sin duda es una responsabilidad inmensa pero los niños no son responsables de los errores de los adultos y si si lo haria si adoptari­a , , , 
NINGUNO,SI PORQUE ES ALGO TRISTE , , , 
NINGUNO,Estoy de acuerdo, , , 
NINGUNO,Si porque no me gustaria que se quede sin la falta de una madre o un padre, , , 
NINGUNO,Yo si lo haria, , , 
NINGUNO,"El problema real no pareciera ser adoptar a la criatura, que eso se puede hacer hasta por compasion. Lograr perdonar la infidelidad es el caso. ¿Luego de que sirve adoptarlo si va a crecer en un ambiente de resentimiento y odio entre los padres? ", , , 
NINGUNO,"Si, pero primero se debe perdonar cualquier acto de infidelidad.", , , 
NINGUNO,"Es difIcil perdonar una infidelidad, pero los niños no tienen la culpa de los errores de sus padres. Asi que yo si adoptaria y  le brindaria el amor y cariño del padre que perdia", , , 
NINGUNO,"la verdad si, ellos no tienen la culpa de los errores de los padres  ", , , 
NINGUNO,"Si adoptari­a al hijo del papa de mi hija, el cual ya no seria mi pareja. ", , , 
NINGUNO,si lo adoptaria , , , 
PRETENSION,"En si una infidelidad es dificil de perdonar, ya que rompia toda confianza que ah depositado en la relacion, seguir con aquella relacion no sera conveniente para la persona afectada", , , 
NINGUNO,"Lo pensaria demasiado por que a pesar de ser producto de una infidelidad, el hijo no tendria la culpa y aunque me estan comprometiendo de primeras lo aceptari­a y dari­a todo para que me reconozca como padre. ", , , 
PRETENSION,"Lo que haria es ayudarlo ya sea con cuidados o de manera economica, el caso menciona que uno de los padres muere pero no ambos si en caso fueran ambos estaria dispuesta a adoptarlo pero si tiene un familiar de manera directa con quien tambien cuenta, lo que hari­a es ayudarlo. ", , , 
NINGUNO,"Si, pienso que un ser tan inocente tal y como lo es un niño, debe recibir todo el apoyo posible en este tipo de hechos lamentables, ademas de que aquel ser vivo no tiene culpa de los actos realizados por su madre o padre biologico.", , , 
NINGUNO,El niño no tuvo la culpa asi que si adoptaria , , , 
PRETENSION,Es para pensarlo pero en un principio si ya que estaria dolido pero el niño no tiene la culpa , , , 
NINGUNO,"Ningun Niño tiene la culpa, hay que ayudar al projimo. ", , , 
NINGUNO,"La verdad que si, la vida no es siempre justa para todos, uno nunca sabe si la propia familia de aquella persona quiera saber del niño o no. Por eso no hay que ignorarlo ya que no tiene la culpa de lo sucedido. ", , , 
NINGUNO,"Si, pero la infidelidad es una falta de respeto en una relacion pero tambien el niño no tienen la culpa de los errores de sus padres. ", , , 
PRETENSION,no la infidelidad no se perdona  , , , 
PRETENSION,"Cuando existe infedelidad es dificil de superar, pero no se ponen a pensar que el niño tambien tiene derecho a un hogar, es verdd lo que se dice ¿Por que no se hace responsable el padre del niño? A pocas personas se puede llamar Padre o Madre.", , , 
NINGUNO,"Si, porque el niño no tiene la culpa de los errores de sus padres ", , , 
NINGUNO,Si pq el niño no tiene culpa , , , 
NINGUNO,"si lo adoptaria , para que el niño no se sienta solo ", , , 
NINGUNO,el niño no tiene la culpa, , , 
NINGUNO,"muy buena pregunta , si el niño queda huerfano sin ningun familiar que  se haga cargo de el . En mi caso si lo adoptaria recordemos que el no tiene la culpa de la infidelidad del pasado y tiene derecho a un hogar. ", , , 
NINGUNO,"Claro que si, el niño no tiene culpa de nada", , , 
NINGUNO,"Como dicen una infidelidad es dificil de perdonar y superar, pero los niñs no tienen la culpa de los actos que comenten los adultos asi que si, si adoptari­a.", , , 
PRETENSION,Intentaria buscar la forma racional de resolverlo pacificamente, , , 
NINGUNO,"Si, ya que el niño no tiene la culpa de nada, aunque la infidelidad no se le perdonaria tan rapido pero eso no es motivo para que el niño no sea adoptado. ", , , 
PRETENSION,"Dependera de como esta la situacion en ese entonces, pero por ahora  mi respuesta es no, el tema de la fidelidad es algo delicado y muy serio.", , , 
NINGUNO,Talvez ....porque ese niño no tiene a nadie mas para que lo cuide y que le den educacion., , , 
NINGUNO,si lo adoptaria porque el niño o tiene la culpa de la infidelidad de uno de sus padres , , , 
NINGUNO,que todos no tenemos el mismo corazon que otros, , , 
NINGUNO,Si xq el niñ no tiene la culpa de lo que hacen sus padres , , , 
